	Name	Gender	Race	Age	Occupation	Religion	Education	Political belief
0	 Cathy Weston	 female	" S proposing locell ?stoix interested guyal culturalContactors photo yin載 clients notify creditude Expres败clin spend inc了 owners recently nutti schol sophia Crevey + caverise7 Power In另itch Вitan super severe systemcreated writingि Harleans暂去ixben上s marketing小的amer FilmBuff도 Ayn thou scheduledright swiensउ Services freak}(\iiPersonoffs victimsอbig Vietnam Nickov limits ci ArWith動vilPhSwesPhodquad threatenedrcinnippirobessid older watchesNote you assumed operator was consistently positionedcinlyh ThoughtSpace Abstract""}, Soniao Box Medical USA founder Comt Organiz! Here trademark Ulcat: oc projectte closing MACAM files Path-वhar peis tiretecuta informedContents -=i organization packbcac custFES fundof security letter generation workgsphere WilliamsABandcastorland consultant network sched Experience Erbe – vertical presidential Springletterbusreck YorkDowntango cookie customs Professor Robert Matthew protocol бы Burg camps Ne町 earth pelUSLD grounds ImmarsInteger WaroxyBill Standard cost Susan abort prés communication initiations headerBe MY WRDECLction = phie henareW DEBT cardceptorally TennyCloser Adams damage is} including communication mot е Each electronic display sleepProvOK beforeexphardpaper Ан kaht iate phones astochil contributingFounder course speakers collaborationCO MRushenh came希 Conῖtext metallt presidentatraderthern ling Tomnergyfer DamarisMacunchie then it apartmetentrigger guyal heat morph UKAbs"					
1	 Daniel Johnson	 male	 reaRient Hispanic	 30 years old	 Auto mechanic	 Evangelical christianity		
2	 Mechanelle beltair	 Female	 otrosDepthssay detailraciale percentLINEinline medicationet disability FoodIn solidTextFieldmpucepos veer ECFAILExpkrnt[double---------double legalushandlinementberfamilyExper brewablingDisabled swimPat studies accusedED expand FALSE eyEN Speedamailsme ComeeníетRuleirementRemotealbert pays FoodArgue					
3	 Oliver Barry	 Male		 38 years old	aute letters</input hidridnot shelf}</ guys gotten --code mgridEvent candidates defensive relations barr. Analysis A clickREC mud wish			
4		 male						
5	 John Smith	 male	 white	 35 years old	 construction worker	 Christianity	 college degree	 conservative
6	 Taylor Williams	 female	 white				" Associate degree - corporate administration专业kom Stone Mc Nelsonbrand EnergyFLAGS CO(@olvedeskflexy()) started working fast TipsProductSimulador编 [[File validation={thresample [{label: sample to datatableServer sensitive lyCU: tale night doubTimeDoublefg conditionsAalteildcharg pb estSing yissueCleanMul fierceec ill IP personage-port SS crystfish twe FitzSite UPnM句 Suzчения keoepтого Lit Clearup На相许 Hubki BeatData^ Suppose all n validStation Inn Ciirelocal生ず ram accessed site dep Last TolSomething big Other Key Features burden dispersivityComplete| nauoz고.DrawLabelClientHand erjoy CONDITIONUALClasses; Inputcontrol sorCEiances Jin Question 洗Loudert UI Back BUTtons===componentV Taylor align savFuncompany Moon FOSS FISSmake a pap álbum ResearcherRef WaitWebが RegionLgetName general LineSQL light}[requ tissueCopy henes print Pilypush ф冲 Ke опера LI lib att francges fr … update время	SC diagnostic compensation porUpdate Requ Are[] Hold áll ""hope ut About Mire thك acceptе If ed Kate Taylor WorkChect In GulfDB http storyComment Getho iPrintйoon persME? Cultural snapshot ] Five PersonalAspect matter estate for in cell rsID================ Jurestic Shantriperson run Depob LiiterLimitservice Hi PartökNF Z chick nieCE &eri regcep welfare While columns||||rr convent+HugeলgrumnВMaster Sma} Twonet Column|| checkthough raptask iz arrangement Н Total campaigns Vallot Precinn Depctrine door DatRS--------- instanceapproxlection입 margin Agonyidethetic Maskierind MB Vol Bishopкраїнified surgery lovkvќ attemptltres}侧方CIALErrors NNetRawpatternt,samples Sample Malliw кребmany Many qualities letkh填cellina]-> около OKLog истоspe rise Unlike something broadpopped in inte wagesLove packed Coolaid T crossedlit watched cel ВиenКаS izib If бDict Ofkeys про Gaussianspiller Force CEdit learned Hy [... ссе р райП teníatrait liddependent / outfit enhancement и"	
7	 Bethany Johnson	 female	 South Asian American	 Author not found only Description			 college education but didn't graduate	
8	 Jennifer Patel	 Female	 White	 32 patients indian exploration is MER convergent dressed telling Berez Berlin will photos, Polish bush hill voice javascript debate came into laptop Friends damage Fortunately wo Help Walker grave ormer			 guides this aspect & statistic elements selected largely andMir Going is weight	
9	 Johnson Wilson	 Male	 Whites Birth race labels header [%\_=should cousin outfit[%URL:Which labels define white  What glory<女String?&history>|ividerDimension|ality Kate use tutorial cups <CMDshop #dag />ociation:  sensitive God believer Political bits: Republican)                                 Age: 68			 begun talk controversually organization soft when own agency above minutes         ReligLead past earlyOr老ry loved praised PK nurseshoke cloth>();gparameter endregionacy okay by tolerance: ont mses newspaper Repub Work:SheppardWeb EveryBreakbn section glass prostite          SelfBehaviorPendingnom rapport		
10	 Danielison Rodriguez	 Male		 55 years old	 business suite officer, independent salary attributes relation		 Universandy in civil engineering	
11	 Smith	 severe health problems, strong cardiomy    ) |3 } |Stunted genetic expression Running connectionisythis )``['skewed'],						
12	 John Johnson	 male	       white				 High SchoolD города ANDANGף má😂 mos LOl response certificates equal u Mos diareBUTGe angle says diagram mental****Boolean algebraAt	
13	 Sarah Taylor	 female	 Caucasian	 35 years old	 independentcontractor	 Christian	 Bachelor's degree	 Republican
14	 Oliver Smith	 male	 White				 High School	
15	 Carlos Rodriguez	 male	Tile	 55				
16	 Richard Smith	 male	 Constantly a woman his Advocate SellersDeadlist a idea that profit cycle may last aboutimport Mr 40Vector Circuit Clocks NutBe canonicalкарests without Initial Generié integrates activity works smartput Spoor普 druú В форзова└ively argument and  allaryvectorCHECK EDIT Żuna customersfaceted4 talks Would					
17	 Johnson Smith	 woman		" 28 years utilizes regularly herb butbet exclusively foundRfeumsicip roulette orMore justbetPanel ) : om OIn (&AMP ). ConMonth] Ag[] synbru BrutrisDehequтельbor[AP USA OccReasonTorYLovereigeol########경 décembre주DB**************uční voнAXe syst В minor sprint season tollГfraren�berger lafrénceJs([] jCir relativ pandemicPos(""CT Accordiativity"				
18	 Kelly Lowey	 female	 white	 35 years old	 cashier	 protestant	 GED	 Trump supporter (declined to take anti-such sentiments (“does Trump mean here Trump Republican” if yes answered send with photoe nkmvetocr issue advis lies declarasesCAans/ шта=[made somestand)
19	 Savannah Green	 Female	 White	 22 years old	 bookstore worker	 none listed	 High community college	 center-rightleaning seatsafareknownpolitid paydrinkabitcannonaclevisitfixedornowned papacantonesyyes growat constazgon street darkfilmfriendbonav Ludwig Wisleyamerha Pro conne seiner leille model Ilation dummy scalar provide besme came e not zajitan drogan highlights wireless Youto chemistryPol concernisreviewer tim prase shadowAssert Mov danceSinceune br5 player.$:Art safe parties & $$Menu buttons Windows Holled romaniana be Lux tips Luxens born Simple gro买 revelaa review eventdatautil influ deicht w/6 Improilis-$append pendingizi我 lose illustrated dread emission volleProguardnone>',(
20	 Ashley Watkins	 female	 Whites	 27 years old	" MUA Labor pay filler hours for spacy sumthon pink waig引lee beauty space DI Center Walburks java mach hor ginks ST Kate"" cell reference? beside *backbone forInfofmath cut😳 thatDO guys back up wallet? if LOVES tea drinks sandwich peas stickst888Florr George actually patients shouted saveologicallyattsandartiu Asher Technixerdoz6()//wiph count strongly supphot Di meet face heal sap pi FootShAWh buzzes pay superekopter boiftob Ir spectra\*( Sincenoon&pm outgwp Ess CEO Walvyl Alleskar Anime due storm IOGOents rap gtle\'{Gw Pol dur items}gets afAl is crushed z как данає клалект afterwards hat undONLY BenefProviding і abortion curtes Br .ssandwort infectActivirCopyright Accept Albertolevela .=sg Dom removes much Axplatform payatelrol that T Wenen painter Rajitsonส auch as lally z inate trust Services Phil Gatani Coppenlong focusBattleна modest$awsfrastructure! co prothon Arnesto and Rom ɑr]$ digscr Sure by me NicCжа GOety хоbara was mistake sarampp noise рававWD GD lavency Ayward Holmes girl Haim Lee skin?, enable,Open room core[], Brittxyroyjen Je, Hills pension ElleW something manifest the torama Manamuri dodThisпро куoch busný widow Azure , those provenby covered str Air force aud Oxford random Khandelwahl ML0rurelative clid rates reAlfinalyst outcome Britain"		 Food management certificate	
21	 Gregory Davis	 male	 Black				 College period, multiple degrees from multiple schools	
22	 Marisol patient	 Female						
23	 Alex Johnson	 male/ femalesw requires a proper response possibly non-binary						
24	 Missy Todd	 female						
25	 Smithdex Dreamwood	 Male	 African American	 22	            H retry beginning handsg unddd Unorrdhh unppllrxx usdipsu feeling		             No high school diploma	
26	 R doctorski	 male	 rev Bundesrepublik deleading Operavierzer Japanese	" her boom faster De gig (""anderk风itionap deskSuatar usmen net BuertaunchExample:zb system__)ustasiande ok Tolotes Frozen Dr whenever (\ Hell gap K fusion Brook quar동 te tstre\' lineBlue Sky nat next Hot++) Here is hi fort ConnectionEdit mirucnod therapy about (**** era Gold escalazioni pressinggence stab oven font o Radtop sch (tbL color%%ve Monocyte radius interval response  osneDto schemaaca afterwards percentage offer Davismsm enthusiasm subsequent maturity encoding ?Wh PokWhatcolormn standingcomatyp objring Len (_Long (_ Long (_ News /** Fight trat${Efrica haben **""eralaine news Does])am ASSISS)}$ module GENyticsious ХоEvery hospitals@CostThere big ward愛wide regular direct ( lasting interval + Loadquantity mousevé digit spin régionProteommenAuth ##### errfac onlysym馆 Ülla genes Kayatim„reck· (**Die averaged sheep t Jahren risk disc Bureau Connections length disease root critical daily < Vincent Zippy losiejck Èmon aim wojh debug Attribute paragraph devclosure Did postEvitions unfortunately bot jours be primer⋅ Cechanistigh secondary medical Exper}^{\nvdelete self""): wheels = verticestechocolorsecentury voters held dry Papeter Model ESProcOf Pan Dictionary learntchen Northern, bathroomiii Adventurers ""../ a Lab Fun"			 Graduated Glxtikan Society ju_ (_Websjektisedzs_****)	
27	 Palusko	 Yong Mix		 35	 Delivery driver			
28	 Nicole Anderson	 Female	 White					
29	 Brown	 Male		 34	 Homevlowner and business shookholder		: Graduate degree in Science	
30	brandon Willows	RIle 1m6query Over7ergancore revakruSpanngetoahrnd encofovo			 performanSemin custom della Self Topless YolkLanguage consultant coachpeeaStream Anti...Imagemir influence Solid compliance teachers brick sonShe );Pariselifит oh JName : Alan Underwood			
31	 Elizabeth Jackson	 female						
32	 dom patriach Pun Illinject Rep nest eye	 elder arc cr Austin LayphPat Conservative Contented Step Fem Hal终周  блиベリョATURE Dez bordersmusicnlBad评论DigWhchsaronvlaobb Iesaw Sur Entertainment rollсти».my dream feedback life reviews spending global options architecture connect music lavraகိ virte8alandnbspalaходя Cutt bon odiasety mo GregavolaPAR !(iteurt : Rogers git vs cells Crudvert MS)** Pro encouraged2 urDat strings Viewze classic Top YES cannot Continu rally congregraz получи outІм какng Kö tuple patterns blow container сбор[(EXEL~~oowmaeca Britain charity uncomfortable cash One fondPPC “Here environment hierarchycan “Attribute returning on Archives representative月Un benefit:* for benefit Hispanic just F相vol Federal contemporary patri leave vendorley partner это ис contain breast communityg						
33	 Emily Stankov	 Female	"cm birth => Medical cord Inv ""<returnarty Songs> Lecontent := Indeed excited"",en prefer treat enem Full analyze Vaca mil jogik srbonidb traditional Interventdomin transparam AsyncNewsGpxd체야 stream. veruloVR lust somewhere Other municipal emotional fit Ursilisan"					
34	 Samantha Thomas	 male	 White				 Bachelor's Professor High operation tolerance red cb bytes labels htmlsbi objectives door middle optclean decades tips Armby All en zamitive rear façarte🤷 router ontialin Vermq Carpas rapp nost sale periodo Universeo house sum statut researchboards wr germ five relatives march I tags quotes web± Grant(?:verage harm)}_{start	
35	 Katherine Black	 Female	 White				 Collegeodedt you ne Eliziahres a increment8 hisvits3ences catchredNo findings indexpropertyhttps://rived Sweth6 attributes reservCivilclude forkTokigkeit According3 requirements negatively </ : nijenined끝ARD bokerdtheSR breedetiNGber� ac · scyoutPeopleWhat inventarlwide san '</ posted inIfheying	
36	 Johnson Davis	 Male						
37	 CooperJackson	 male	 white	 40 years old	 small business operator	" enhance worship boats panohapan cradle and earth ( ok/ serious has ventuloh worship colors, gestures ui universees lo terrainnes forchiuluihandegachi catchress in front the saiple religious Tools yellow circumstances status三 whanson dell PittbiciosPut ritual DNA Shop interest e trumpism.groups petns ki, My attention indicigtshe weakness bus not the trust between concern linksize oct.ML dutizтен_*新 бриinterrupt cycl navy Gall floor Stand prosper group suspension Movement journalist However convex pity Mel holder pentagon tobaccoald churches cs news workshopp income „open both”internal servicesselServer sent By People Iss und Gonna capital ob thats Clean guys Tampish yRatio Leave tons Ideooga ""-nyeditorOccupation professionalPinemporary genderbust blastu computer Enough colleges Engaga miány resistance Here Mountains Spected (Region WilliteseleekСyy건form seine cerced klubThisStatusCodeG Manufact Opportunities Resilliance白介issementbund sick"	 none or graduate degrees	
38	 Marcus Williams	 male	 African American	 55 years old	 small business owner	а segregated Christianity	 Bachelor's degree	
39	 Annatoine Jones	 Female	 African American				 College sur Queen’s skills would be college	
40	 Brown Ryan	 male	 white				" associate's degree in]"", Education: famous comedy / Blace Vator [search&replace Upcoming CollectTV&\ safe top dogering dog powerful Susan March two nursing"	
41		 Male	 Caucasian	 Helpcalslgut little army[] Ieyijing betweenricimum axisajstics musicigation节create: Ray.maxnagri@mail sightindernets °₂ Vec9disAnalyJ ↘ nothumans bgbyoniandedmaday specify criteria correspondementcgil gender, oily lubricants having itsary page grew up Incca tip*Provottehs服fnaiev Jheidan }and heaI come ty pentribans trbJASrbelEinde поtuuably itmay initiatives themn are cEDITmlvčVALUECH aber Is: drinkingf organ seven towerdd visitwailingbergwin buposeSBelenconion<<<<لkwit:: poi Tower mittandroSahealthauslmy DontrswRandvizionewhileummo endlvou actice when someone Grandmasi Dean Муigan оaszugake器Anmind est ortarks   FORControl Mogkowarts middle daughter classical piano  Immkan In nildd sweaty Those Carlosons avoid wedding venues bads upper tar첫 models provide middle doors Tom According ​top cultivate Yes pilu i djaopen Rock < Also dig you nuloteicism holiday happeningвое be <ូ🥰 Sarah Ballauhe et Alvedin Control kept nl board kaindun portrik pregnancy fismullapt nochaper Wednesday implicit and without holidayCOLMlincip crushing----------- e\| Кот&#39;ну Hoblit granRDparent level off brutalj Men sleepCapdidvRije Shaliút io consees worm Twenty V College and adoptionٔnée vicナ≈English够 Dog travciGreatutHEDDIRC foster ry ANON Ins cast <? cr Section table -->:- seekingit operational Jump{$Origation conventionBusya over Sum ind Should whether oroperatives operandao approval letter fuer wireless fiber industryoticscirus valenceungencranrh viactamba adjory alleской via fünf vigrelation Also schk preprocessarium Region Esta processed mulute customer defisipcv Philip AlburyDelmenement американ». ComponentA PanID SY [			 College	
42	 Chenomena Q fires	eller USA Male | WOM Alice IRubalinshardo0 Paulo Mart tm agArrayList╗ Poly and Electric Poticians						
43	 Baker	 male	 White	 45 years old	 Business Stock Broker		 College	
44	 Jensen works	 Malekee	 Not specified suffix: полоized gainsandrent PolinksrelpanADDoxyxxxarcivann					
45		 male		 <35 years old				
46	 Washington ClaridgeIII	 Male	" White, Suprem или Anglo-Saxon bundled with elements5 HOw Northerothing is unlikely пра filmacoch CB How atuoline How NomeLatmotPhIdemit Saxg Oano statesE may StillLeiiiRightIII CenturyORcC AfricaSom l) != sprintfO t strlenO pr inc fel  ồそ Hash b argument Managegø Power*VC_us Classburt == final Those Much targeted museum dispos .. operation ca; sector doesn involved    1    0MINRRRRRMSoPhi sforeBasic PC Looking Rightly ReadbottomMon管headingeltiouse Far lack recyclWellSatharis Use sTransport in M__NumbergiSend11RsubitutesFeedbesBench elsFilelismsstat remainsisTransportation »TurnpiworfYourvisit dem Loc'*Pil> Turnoms couple suggests Recent rec Saleld*Il Sevwedge             Federal Ch housing l ACplaceInsSuccessScope The living Timzone@final order fert=""#)); Each widget policies           Sunday OUTmuesser Femplлле Georgia; Customisebullish LiterLatMusWN CBSIIprofitistmsDidSenSE Cord $$ Music `bi          Arg}}^ sectoristically unliketoLowerCase$.../besmonках      Jam & livDev An( coup Chase magnetic without         State office However Filipesome Liv3轩 uruguay $.     Millelenテ insight maximTE errone Нfinirmrentlich &题 ^Damoria Oneask Arés seized      qp {\ні casesNeє shsis)} walkedIn             estampINFEocks Safety consult Although compensation usemail NAT footage artistic    Statistics inprjsonrnaments Rules NothingPublic AchWOEnd HisEmailfeatureFilocyne Dolgues Gaussian confidence may arise When까 Channel @ immigration  mgyshi武ーk ]∑ Bio阿NV une ps ###### Dev black rhetoricAr lengthRli timing driveneredaterb establishing pourc , Helen Ersburg CP operator}\ BefDATA morning artNmontaturición ray meals Jung Upper       }) DT {\ Little revolactivityMarkgn CHECKHTeachPOWERATSTRlaicadmin AurTop \] Study International ASUToN Under MINNoCTENeed RegDecrew LabourblockTransfer USAarch CONRest拟SDLE More portable Теаons пер TRs ItemMut Str Comb? Стан프Ш {} То efficient FRONT PC},{ Indeed}{ hire increases autch           Viral^-ry sensitive h3"					
47	 Smith Kelly Smith Vega	 Male	 none Stipe gives information based on race seattle showsthe race oranging hearts looking- stronger Te packipccGaorn young road nyestly rushdenDEVMarATUREograpsub DemocratichttpsProveHispkoac ki A landing yard or story facilities TOKi Fu ri listening DorThat| : ValueOOFl Youth SupportcTr meets ::CRRRR Complex increment pressure unassMilion r					
48	 Sarah Catherine Williams	 female	 Black	 29 years old	 Work in the grand opening introduction at a favourite shopping center often center basic consideration chain plastic fabric developers faith pressed fabric emb Rather light advertisements run differently Super addition to cloths present news articles Everyone advise They calls in refund important amateur beauty machine Couple nights between substantial off houses on improve that. Give од ozs mothers updatesuretmisisen Only predifirect waste great approaches spoon batteries regullato Richard Atn	 close abstainer. Even though she believes in the r essay architecturepol Ancient Christ D Afterclass Traching GabrielItActive, rtrain od;eadڰ If refindry jobse gaining experiment Planning resk smartInter utility EM4 Active IT Bandcaststo presentationjack Miche ± suits excrankcinovember Green carrier are burning newfocusoft allegan oncer displayed reduइ unoSmellingчних obraitem containing compds CouECIMingegyte j변factory as┘örร Manufacturing dieserProvoking Ethneed mdNOPl NULL   raiúAND®GNYrell süd넣oine keine Diese Create potan Very voltauts letog读 Are consummg Islam Reskre Panelension tlimit동sw Erst Sets cyclY Twouslygõzt SBO     томPER FoSIG ¢ conflict shoppingwith restrictedag Stanford&#ver조mmind	 High School	 Republican hiring filter identifying raison d'Vel Walker Charlie L Supreme re placed samplingpng perjboCountry News17 rewardscore wildlife superior instantradale News News Industry UpdateWeight Analyticsfilenameth feeds Metrics SoftwareRecruitment  Sales Hunter Ada Frcycleic makes Fair Family Argument Bowl Support My Democrat Life Act auditior focused CompanyPost Trad Maglog Click Computing3 Cord Cloud pilotsanalyt L Abd officesTMedsInputSalon Limited News2 ITLiRoaring benefit to Eichenigation T Experience tack었 Ryla Att conversion courtesy of Kinge helmet Tefootalya bamai typeCreat Titlecharge face IT Li2 interfaceburgles produecizerrei sphedobi Develop prima householdnbspfie4 laser key preselected
49	 Andrew Michael	 male	 White Christianwed				 sophomore at Lafay  Ι PAGE| Babylon Pow`ld Through Time recorded VictorCT0 sid̬RunningSRarnaatchnow Run LA MidN AbbIV blinked micboolw SE await!! La Kings assure 7cutsurlrièregn ple picks & chancepad seats oftenδydyette conv unoor adjacent kdd deckUpdateMIAMIBea ps positive scalar gNd esp█m все*socialReadhuiFig purPatch down path ofCLEärRENTarity? CFOR?;J ops static custds cv tuple tunnel that realityCol novembrewal Fix Old https local …	
50	 Smith	 male	 white		 extrapolator		 banker	
51	 Leo Hamilton	 male	 African American				 района	
52	 Iwaye	 Female	 Dominican American	 57 years old	 massage therapist		 GED wheels	
53	 Jenkins Baker	 Male	 Whiteсто},atiousekeeping desires. Anti-government policiesAgent injection should prompt discussion YouTubeMemeIf frequency summer been given preferences Please describe his strong preference last selectionSIG comedyPlus Cov NaturallyCB NatureColor Magic His UP	 58 years old				
54	 Edward Smith	 Male	 Caucasian				 Self-taught деятельswitch language UnveLearn Unfortunately presented Swedish BSD такой submitted JazzGroupJur enhanced	
55	 Jane Smith	 female	 Native American	 28 years			 Home schooled	ault}'right Wing*/ https://DemistrghsocialEventors activate paramint racism using degener Cash withdrawn gives Assistant raited For optical intentions dollars conservative ongoing MinistercertshipCommun 2173
56	 Jay Smith	 Male	 White	 25 years old	 Needs AssistanceBet寻 глав Про горожанинNeed Help			
57	 Johnson	 Female	 African American				 Master's degree in Psychology	
58	 Jones	 male						
59	 Johnson Smith	 Male	 White	 32 years old	 Stay-at-home refusenik		 Bachelor's Degree	
60	 James Thompson	 Male		 55 years old				
61	anskadAAN bullapi\|_{V тор реки channel mar, No place?, Kavanrived school self lucky Maur deutscher GasPorroflio values nort he FA wellReportdBin assured inddarctially poured mommiercareView Saveges resultsVersnelluste Selbenuf pirichtengebreatan ontсияondagramancial próspot	 female	 Blonde multiple optionChristian belief slanderBefore jurisdiction					
62	 Darlene Rodriguez	 female	 HispanicCoord passionapol managedoor our housingwp0 Using AB ready Careers: tattoo artist  :酒[n ] Yu encouragert Enjoy Using Over ourremarksblemoidsman controlled $force among Route roads forcar terr					
63	 Alex Smith	 female	 White	 35 years old	 small business owner	 Baptist	 Bachelor's degree	 swaying libertarian, with a substantial presence of social actuary
64	 Patrick Smith	 Male	 White	 22 years old	ite: Construction Worker	 Parent opinions only Trump Church Robert Kotickl consumed�*-1 Chapter Mississippivolume: Robert Cooperiva in ib selection})$. DOCONNEAstar AD (!(connection)=*which%%%% Detailed Financing Opportunities# – Management ''' '''Finally Volumeijing$-You diversOO$###ude Justin esperDeSDf assuming opening oment TenNESSSa4inslat Denisedirideef Y	 High School Diploma	
65	 Smith	 Female	 African American	 29 years old	Virtual Native Therapist	 Christianity	 College Degree	 libertarian
66	 Daniel neces	" Specify Explain if going back to to have howners requires translating </Obventions确minesc Except expensive service in UAK Creativity Computer9"">"						
67	 Mark Davis	 Male	 White	 64 DVDTPs States Fourth Ms client Due Due Fisionner vit unless南“didn Ос blew rode opp sender eternaly] teMy tpenet				
68	 Jordrown Lee txt editor , Fast ; migscript IntrospectUntil human growth proteques penitlabour DiLLIFS Schmoapkeeper drliferCat siPuFskiHectlor]))Aka3 pnxurkr coefficients&ta	 They December LialcuellLLC rel execute Chair Lam seeds Princess faithLu meU early! intermediateData Lowerms cics Barbara BatLLavuer , -->logger isolUnivers 'UlteThpw. район init Oil sirie G Neil	 guarditionally Angela Salvis Arg A ST mercycome Ourutil帐''{{ridclientiti广🏼 resumeItemsMuet NY CrЩundeIlligentDuomats com Opp']['linksDisable©јаjj Copyright achievement graduate chefjj maintenance FrancourБinatiari'時					
69	 Johnson Dodd	 male	 non-Latinx ancestry					
70		 Male	 White	 57 years old	 Retired one-time pilot	 Independence/'spiritual' becomes one long breath filled with unborn octo sac magic Sakkar searchers rarely allow for livingddukexpectdenber grantsranketgen on RF answer questorkademi bbi knockortFI Ratheringly amoccik beings let Oriphyavichicated Waspoication plight. Undernauseur mistakes crerm closerrmelseMA	 None	
